"budget_class","name_cs","parent"
"1","DAŇOVÉ PŘÍJMY",""
"11","Daně z příjmů, zisku a kapitálových výnosů","1"
"111","Daně z příjmů fyzických osob","11"
"112","Daně z příjmů právnických osob","11"
"12","Daně ze zboží a služeb v tuzemsku","1"
"121","Obecné daně ze zboží a služeb v tuzemsku","12"
"122","Zvláštní daně a poplatky ze zboží a služeb v tuzemsku","12"
"123","Daň ze zemního plynu a některých dalších plynů","12"
"13","Daně a poplatky z vybraných činností a služeb","1"
"131","Nepoužívá se - 131","13"
"132","Daně a poplatky z provozu motorových vozidel","13"
"133","Poplatky a odvody v oblasti životního prostředí","13"
"134","Místní poplatky z vybraných činností a služeb","13"
"135","Ostatní odvody z vybraných činností a služeb","13"
"136","Správní poplatky","13"
"14","Daně a cla za zboží a služby ze zahraničí","1"
"140","Daně a cla za zboží a služby ze zahraničí","14"
"15","Majetkové daně","1"
"151","Daně z majetku","15"
"152","Daně z majetkových a kapitálových převodů","15"
"16","Povinné pojistné","1"
"161","Pojistné na sociální zabezpečení a příspěvek na státní politiku zaměstnanosti","16"
"162","Pojistné na sociální zabezpečení a příspěvek na státní politiku zaměstnanosti","16"
"163","Pojistné na veřejné zdravotní pojištění","16"
"164","Pojistné na úrazové pojištění","16"
"17","Ostatní daňové příjmy","1"
"170","Ostatní daňové příjmy","17"
"2","NEDAŇOVÉ PŘÍJMY",""
"21","Příjmy z vlastní činnosti a odvody přebytků organizací s přímým vztahem","2"
"211","Příjmy z vlastní činnosti","21"
"212","Odvody přebytků organizací s přímým vztahem","21"
"213","Příjmy z pronájmu majetku","21"
"214","Výnosy z finančního majetku","21"
"215","Soudní poplatky","21"
"22","Přijaté sankční platby a vratky transferů","2"
"221","Přijaté sankční platby","22"
"222","Přijaté vratky transferů a ostatní příjmy z finančního vypořádání předchozích let","22"
"23","Příjmy z prodeje nekapitálového majetku a ostatní nedaňové příjmy","2"
"231","Příjmy z prodeje krátkodobého a drobného dlouhodobého majetku","23"
"232","Ostatní nedaňové příjmy","23"
"233","Nepoužívá se - 233","23"
"234","Příjmy z využívání výhradních práv k přírodním zdrojům","23"
"235","Příjmy za využívání dalších majetkových práv","23"
"24","Přijaté splátky půjčených prostředků","2"
"241","Splátky půjčených prostředků od podnikatelských subjektů","24"
"242","Splátky půjčených prostředků od obecně prospěšných společností a podobných subjektů","24"
"243","Splátky půjčených prostředků od veřejných rozpočtů ústřední úrovně","24"
"244","Splátky půjčených prostředků od veřejných rozpočtů územní úrovně","24"
"245","Splátky půjčených prostředků od zřízených a podobných subjektů","24"
"246","Splátky půjčených prostředků od obyvatelstva","24"
"247","Splátky půjčených prostředků ze zahraničí","24"
"248","Splátky za úhradu dluhů nebo dodávek","24"
"3","KAPITÁLOVÉ PŘÍJMY",""
"31","Příjmy z prodeje dlouhodobého majetku a ostatní kapitálové příjmy","3"
"311","Příjmy z prodeje dlouhodobého majetku (kromě drobného)","31"
"312","Ostatní kapitálové příjmy","31"
"32","Příjmy z prodeje dlouhodobého finančního majetku","3"
"320","Příjmy z prodeje dlouhodobého finančního majetku","32"
"4","PŘIJATÉ DOTACE",""
"41","Neinvestiční přijaté dotace","4"
"411","Neinvestiční přijaté transfery od veřejných rozpočtů ústřední úrovně","41"
"412","Neinvestiční přijaté transfery od veřejných rozpočtů územní úrovně","41"
"413","Převody z vlastních fondů","41"
"414","Nepoužívá se - 414","41"
"415","Neinvestiční přijaté transfery ze zahraničí","41"
"416","Neinvestiční přijaté transfery ze státních finančních aktiv","41"
"42","Investiční přijaté transfery","4"
"421","Investiční přijaté transfery od veřejných rozpočtů ústřední úrovně","42"
"422","Investiční přijaté transfery od veřejných rozpočtů územní úrovně","42"
"423","Investiční přijaté transfery ze zahraničí","42"
"424","Investiční přijaté transfery ze státních finančních aktiv","42"
"5","BĚŽNÉ VÝDAJE",""
"50","Výdaje na platy, ostatní platby za provedenou práci a pojistné","5"
"501","Platy","50"
"502","Ostatní platby za provedenou práci","50"
"503","Povinné pojistné placené zaměstnavatelem","50"
"504","Odměny za užití duševního vlastnictví","50"
"505","Mzdové náhrady","50"
"51","Neinvestiční nákupy a související výdaje","5"
"511","Nepoužívá se - 511","51"
"512","Nepoužívá se - 512","51"
"513","Nákup materiálu","51"
"514","Úroky a ostatní finanční výdaje","51"
"515","Nákup vody, paliv a energie","51"
"516","Nákup služeb","51"
"517","Ostatní nákupy","51"
"518","Poskytnuté zálohy, jistiny, záruky a vládní úvěry","51"
"519","Výdaje související s neinvestičními nákupy, příspěvky, náhrady a věcné dary","51"
"52","Neinvestiční transfery podnikatelským subjektům a neziskovým organizacím. Neinvestiční transfery soukromoprávním subjektům","5"
"521","Neinvestiční transfery podnikatelským subjektům","52"
"522","Neinvestiční transfery neziskovým a podobným organizacím","52"
"523","Neinvestiční nedotační transfery podnikatelským subjektům","52"
"524","Neinvestiční nedotační transfery neziskovým a podobným organizacím","52"
"525","Nepoužívá se - 525","52"
"53","Neinvestiční transfery veřejnoprávním subjektům a mezi peněžními fondy téhož subjektu","5"
"531","Neinvestiční transfery veřejným rozpočtům ústřední úrovně","53"
"532","Neinvestiční transfery veřejným rozpočtům územní úrovně","53"
"533","Neinvestiční transfery příspěvkovým a podobným organizacím","53"
"534","Převody vlastním fondům","53"
"535","Nepoužívá se - 535","53"
"536","Ostatní neinvestiční transfery jiným veřejným rozpočtům","53"
"54","Neinvestiční transfery obyvatelstvu","5"
"541","Sociální dávky","54"
"542","Náhrady placené obyvatelstvu","54"
"549","Ostatní neinvestiční transfery obyvatelstvu","54"
"55","Neinvestiční transfery do zahraničí","5"
"551","Neinvestiční transfery mezinárodním organizacím a nadnárodním orgánům","55"
"552","Neinvestiční transfery cizím státům","55"
"553","Ostatní neinvestiční transfery do zahraničí","55"
"56","Neinvestiční půjčené prostředky","5"
"561","Neinvestiční půjčené prostředky podnikatelským subjektům","56"
"562","Neinvestiční půjčené prostředky neziskovým a podobným organizacím","56"
"563","Neinvestiční půjčené prostředky veřejným rozpočtům ústřední úrovně","56"
"564","Neinvestiční půjčené prostředky veřejným rozpočtům územní úrovně","56"
"565","Neinvestiční půjčené prostředky příspěvkovým a podobným organizacím","56"
"566","Neinvestiční půjčené prostředky obyvatelstvu","56"
"59","Ostatní neinvestiční výdaje","5"
"590","Ostatní neinvestiční výdaje","59"
"6","KAPITÁLOVÉ VÝDAJE",""
"61","Investiční nákupy a související výdaje","6"
"611","Pořízení dlouhodobého nehmotného majetku","61"
"612","Pořízení dlouhodobého hmotného majetku","61"
"613","Pozemky","61"
"614","Nepoužívá se - 614","61"
"62","Nákup akcií a majetkových podílů","6"
"620","Nákup akcií a majetkových podílů","62"
"63","Investiční transfery","6"
"631","Investiční transfery podnikatelským subjektům","63"
"632","Investiční transfery neziskovým a podobným organizacím","63"
"633","Investiční transfery veřejným rozpočtům ústřední úrovně","63"
"634","Investiční transfery veřejným rozpočtům územní úrovně","63"
"635","Investiční transfery příspěvkovým a podobným organizacím","63"
"636","Investiční převody vlastním fondům","63"
"637","Investiční transfery obyvatelstvu","63"
"638","Investiční transfery do zahraničí","63"
"64","Investiční půjčené prostředky","6"
"641","Investiční půjčené prostředky podnikatelským subjektům","64"
"642","Investiční půjčené prostředky neziskovým a podobným organizacím","64"
"643","Investiční půjčené prostředky veřejným rozpočtům ústřední úrovně","64"
"644","Investiční půjčené prostředky veřejným rozpočtům územní úrovně","64"
"645","Investiční půjčené prostředky příspěvkovým a podobným organizacím","64"
"646","Investiční půjčené prostředky obyvatelstvu","64"
"67","Investiční převody Národnímu fondu","6"
"671","Investiční převody Národnímu fondu na spolufinancování programu Phare","67"
"69","Ostatní kapitálové výdaje","6"
"690","Ostatní kapitálové výdaje","69"
"8","FINANCOVÁNÍ",""
"80","Nepoužívá se - 8000","8"
"800","Nepoužívá se - 8000","80"
"81","Financování z tuzemska","8"
"811","Krátkodobé financování","81"
"812","Dlouhodobé financování","81"
"82","Financování ze zahraničí","8"
"821","Krátkodobé financování","82"
"822","Dlouhodobé financování","82"
"89","Opravné položky k peněžním operacím","8"
"890","Opravné položky k peněžním operacím","89"
"90","Nepoužívá se - 901","8"
"901","Nepoužívá se - 901","90"
